<!ELEMENT employee (emp)>
<!ELEMENT emp (eid,empname,department,designation,salary)>
<!ELEMENT eid (#PCDATA)>
<!ELEMENT empname (#PCDATA)>
<!ELEMENT department (#PCDATA)>
<!ELEMENT designation (#PCDATA)>