<?xml version="1.0" encoding="UTF-8"?>
<!DOCTYPE employee SYSTEM "external.dtd">
<?xml-stylesheet type="text/xsl" href="xml_style.xsl"?>
<employee>
    <emp>
        <eid>1</eid>
        <empname>Santosh</empname>
        <department>Marketting</department>
        <designation>HR</designation>
        <salary>1000000</salary>
    </emp>
    <emp>
        <eid>2</eid>
        <empname>Sachin</empname>
        <department>Sales</department>
        <designation>Manager</designation>
        <salary>1500000</salary>
    </emp>
</employee>